{
  "schema_version": "0.1",
  "kind": "wallguard_policy_decision",
  "decision_id": "wg-decision-same-wall-allow-001",
  "policy_ref": {
    "policy_id": "wallguard.professional_workroom.v0",
    "policy_version": "0.1.0",
    "policy_authority": "SocioProphet/policy-fabric#86"
  },
  "wall_context": {
    "workroom_id": "workroom-client-a-matter-x",
    "client_id": "client-a",
    "matter_id": "matter-x",
    "wall_id": "wall-client-a-matter-x",
    "confidentiality_class": "matter_restricted"
  },
  "subject": {
    "subject_id": "agent-research-001",
    "subject_type": "agent",
    "wall_memberships": ["wall-client-a-matter-x"],
    "acknowledgments": ["ack-wall-client-a-matter-x-v0"],
    "recusal_state": "none",
    "session_state": "wall_scoped"
  },
  "action": {
    "action_type": "retrieve",
    "enforcement_point": "sherlock_search"
  },
  "resources": [
    {
      "resource_id": "doc-client-a-matter-x-001",
      "resource_type": "document",
      "labels": {
        "client_id": "client-a",
        "matter_id": "matter-x",
        "wall_id": "wall-client-a-matter-x",
        "confidentiality_class": "matter_restricted"
      }
    }
  ],
  "destination": {
    "destination_id": "workroom-client-a-matter-x",
    "destination_type": "workroom",
    "labels": {
      "client_id": "client-a",
      "matter_id": "matter-x",
      "wall_id": "wall-client-a-matter-x",
      "confidentiality_class": "matter_restricted"
    }
  },
  "decision": {
    "outcome": "allow",
    "reason_code": "same_wall_allowed",
    "reason": "Subject, resource, and destination share the same wall context and the subject has an active acknowledgment."
  },
  "receipt": {
    "receipt_id": "wg-receipt-same-wall-allow-001",
    "decision_id": "wg-decision-same-wall-allow-001",
    "policy_id": "wallguard.professional_workroom.v0",
    "policy_version": "0.1.0",
    "outcome": "allow",
    "reason_code": "same_wall_allowed",
    "receipt_visibility_class": "internal",
    "evidence_refs": ["SocioProphet/ProCybernetica#103"],
    "redaction_summary": "No payload content included in receipt.",
    "residual_restrictions": ["matter_restricted"]
  }
}
